Person,Text,Date
Mentee commented at,"11:30AM November 5 
Intro: Thank you for your patience! I had a pretty eventful last few days. Today, I was out for the majority of the time playing badminton, playing the Switch with my friends, grabbing dinner, going shopping, then grabbing dessert. I just got home but I’m exhausted. I’ve also been applying to more businesses. Technically, I’m doing accounting, but I really want to find a role related to English. Fingers crossed!
Happy Halloween to you too! Did you do anything fun? I saw on my Instagram that most people were partying. I was so jealous since I was stuck at home taking my business finance course.
As for the car requirement… well I think it’s just the location I’m in. A lot of people don’t drive so some jobs require a driver's license because they don’t want an employee who relies on public transportation. I do get it but it makes finding positions a lil difficult.
A: Eh, it's okay. I don't mind it, hope you had a good time lol. Yeesh, I'm sorry.
Q1: Happy Halloween to you too! Did you do anything fun? I saw on my Instagram that most people were partying. I was so jealous since I was stuck at home taking my business finance course.
A: Meh, I treated it as a normal day. But I did go out with my parents to watch fireworks though!
Q2: Oh no : ( Did you get meds for that? My sister has had a cough for a month now. I think she should see a doctor, but uhh that responsibility falls on my mom haha
A: Nah.
Q3:  What did you think of it? The tickets are pricey but I like it.
A: It was fun lol.
Q4: Word of the day!: Erinaceous – like or relating to the hedgehog. Crazy how there’s a whole word dedicated to things similar to one specific creature.
A: LOL
Q5: I don’t have a machine : (. I bought a small hand kit from H&M a couple years back and I’ve been using that. Though I’m not good at it, having the sewing set has been incredibly helpful.
A: Oh, well that's something I guess
Q6: See, I like the IDEA of a fancy banquet with the glitter and the glam; HOWEVER, the thought of attending them fills me with dread. It always seems better from afar. I think that’s a lesson from The Great Gatsby if you’ve seen the movie or read the book.
A: ROFL, fair enough. I don't think I've seen the movie or the book
Q7: Oh, I mean in the States. In all the media I’ve seen, they go for regular check ups but I found it interesting that Canada doesn’t do that.
A: Naw, I don't live in the States and I don't think I have but I guess their healthcare is more on the ""expensive"" line than Canada is. The problem is mostly the government and their lack of esteem. (I'm gonna try not to get too political here rofl but otherwise, yeah.)
Q8: Song of the day: Gorgeous by Taylor Swift.
Speaking of Taylor Swift, are you a fan? I heard she’s coming to Vancouver for her tour. I do listen to her music but I don’t keep up with her personal life. My friend wants to go to the concert so we’re going to try to snag some tickets when they release next week. Imagine my surprise when she told me the tickets are on sale soon but the concert itself isn’t until the END of next year. Gosh.
A: Meh, not anymore. I listened to some of her songs in middle school, but outgrew that phase in highschool (Long story short, I listen to her songs once in a while, but I'm not a hardcore fan and I can't necessarily stand her fanbase either. I'm not really sorry for that part though.)
Q9: Nu pratar jag på svenska! Kommer du att ta reda på vilket språk jag talar på? Ce n'est pas grave si vous ne savez pas puisqu'il y a toujours du français 😊
A: ROFL, okay
Q10: Bonus questions – What’s the best board game? If you were gifted a giraffe, what would you do with it if you couldn’t sell or give it away.
A: I'd probably use it as free transportation ROFL. And the best board game would either go to Game of Life or Monopoly to be honest.
Quote of the day: -""You can be stronger than the wind. You can be more steadier than a tree. But in the end, it's inner peace that matters the most."" -Unknown
Song of the day: Good Time by Owl City and Carly Rae Jepsen
Have a good Sunday!
A: You too :) Adios! (人•ᴗ•)｡*ﾟ+✧･ﾟ✧",11:30AM November 5
Mentor commented at,"12:15AM November 5 
Thank you for your patience! I had a pretty eventful last few days. Today, I was out for the majority of the time playing badminton, playing the Switch with my friends, grabbing dinner, going shopping, then grabbing dessert. I just got home but I’m exhausted. I’ve also been applying to more businesses. Technically, I’m doing accounting, but I really want to find a role related to English. Fingers crossed!
Happy Halloween to you too! Did you do anything fun? I saw on my Instagram that most people were partying. I was so jealous since I was stuck at home taking my business finance course. 
As for the car requirement… well I think it’s just the location I’m in. A lot of people don’t drive so some jobs require a driver's license because they don’t want an employee who relies on public transportation. I do get it but it makes finding positions a lil difficult. 
 
Oh no : ( Did you get meds for that? My sister has had a cough for a month now. I think she should see a doctor, but uhh that responsibility falls on my mom haha
 
What did you think of it? The tickets are pricey but I like it. 
 
Word of the day!: Erinaceous – like or relating to the hedgehog.
Crazy how there’s a whole word dedicated to things similar to one specific creature. 
 
I don’t have a machine : (. I bought a small hand kit from H&M a couple years back and I’ve been using that. Though I’m not good at it, having the sewing set has been incredibly helpful. 
 
See, I like the IDEA of a fancy banquet with the glitter and the glam; HOWEVER, the thought of attending them fills me with dread. It always seems better from afar. I think that’s a lesson from The Great Gatsby if you’ve seen the movie or read the book. 
 
Oh, I mean in the States. In all the media I’ve seen, they go for regular check ups but I found it interesting that Canada doesn’t do that. 
 
Song of the day: Gorgeous by Taylor Swift. 
Speaking of Taylor Swift, are you a fan? I heard she’s coming to Vancouver for her tour. I do listen to her music but I don’t keep up with her personal life. My friend wants to go to the concert so we’re going to try to snag some tickets when they release next week. Imagine my surprise when she told me the tickets are on sale soon but the concert itself isn’t until the END of next year. Gosh. 
 
Nu pratar jag på svenska! Kommer du att ta reda på vilket språk jag talar på? 
Ce n'est pas grave si vous ne savez pas puisqu'il y a toujours du français 😊
Bonus questions – What’s the best board game? If you were gifted a giraffe, what would you do with it if you couldn’t sell or give it away. 
Have a good Sunday!",12:15AM November 5
Mentor commented at,"12:51PM November 4 
Hey Jen! I'll be sending you my reply later tonight. I was halfway done writing it but I realized I had made plans to play badminton today lolol
Had to rush out. Hope you're doing well this weekend so far!",12:51PM November 4
Mentee commented at,"11:50AM October 31 
Intro: Hi, Jen! I’m baaaack. Thanks for your patience : )) I got all my grades back. Honestly, I think I did as expected on one, better than expected on another, and worse than expected on the last one. So, to average out, I did ok. I’m 100% alright with that as ok is better than bad ahaha.
Now that I’m outta that slump, I’ve been loosely job hunting. It’s been hard because everyone only wants full timers, or you need a class 5 license. I don’t even have a regular license. Right now, I applied for two accounting positions which I think I won’t get cause they did ask for people with experience. I applied anyways cause why not. Then I just applied for a concierge position. The hours are awful (for me). They want 8am to 4pm and I go to bed at 8am sometimes.
My friend recently got hired for an accounting position which is fantastic. I’m super proud of her. But now I feel like I should be trying to gain more experience because I’ve been at my current job for almost two years now. I’m eyeing some receptionist roles, but my friend told me she had gone to a bunch of receptionist interviews and they’re super picky with hiring. 
One thing for sure – I will never go back to retail. No more Christmas songs for me, please.
A: Hey Lisa, happy Halloween (at the time I'm writing this lol). Congratulations on your tests! And Class 5 licenses usually depends on the field of work you want to go into. I 100% don't know much about it, but I wish you luck!
Q1: How’s your throat? Everyone around me has been sick for weeks. I think there’s a cold going around. I’ve definitely heard about lululemon people but usually they’re like lululemon teens rather than the moms. Is her dog super friendly? I remember loving going over to my friend’s house in hs because he had a dog. I wasn’t allowed a pet so I enjoyed the times with his dog. His name was pronounced as “Askim” so whenever people would ask my friend what his dog’s name is – he’d just say “Askim” as in Ask him.
A: Lol, I guess it's fine now. I think I have a chest cold/infection, idk honestly lol. Yes, her dog is usually friendly once you get to know her :D Lol
Q2: Ripley’s aquarium of Canada sounds cool. I love aquariums. Have you been to the Vancouver Aquarium? They have animals and insects along with the aquatic animals. I didn’t realize that wasn’t common until I went to one in Japan and they only had water creatures.
A: Lol, yes I have been to that aquarium twice XD.
Q3: Word of the day!: Hullabaloo – a loud, continued noise or mixture of noises.
A: HAHAHA LOL
Q4: Are you good at sewing? I got a new tank top, but the strap ripped as soon as I tried it on. I sewed it back, but I don’t know if I did it correctly.
A: When it comes to the epitome of sewing, I'd say I'm average at it even though I don't sew much anymore. As for the broken strap, I would try double-stitching with the machine (if you own one), as it usually does work on some occasions.
Q5: Movies set in the past always have the best costumes. Sometimes I wish balls were still a thing so I could wear a fancy gown.
A: Lol. Imagine this if you will, but I don't know if fancy banquets count, but that's probably the closest we'll probably get in today's world haha.
Q6: Glad to hear everything went well in your appointment! One thing I always found interesting about the doctor is that, in Canada, we only go when there’s already an issue but in the States, they have regular checkups? Like do you just go there, have them ask a bunch of questions, then leave? What if you’re doing fine? Do they charge you if nothing is wrong but you went for a checkup anyways?
A: Apologies, I'm not sure what you are trying to imply. Are you talking about what healthcare is like in the States or in Canada? If it's the States, I have never went to the States for a medical appointment. But in Canada, I don't think so. Most of the time, Canada's healthcare is ""free"" I guess. (except meds though.)
Q7: I did not know that the unicorn was Scotland’s official animal loool. That’s super interesting. I didn’t know you could have a mythical creature as your official animal.
A: Well, I guess you learn something new everyday haha
Quote of the day: -""Beauty is being the best possible version of yourself, inside and out."" -Audrey Hepburn
Song of the day: Sunflower by Post Malone and Swae Lee :D
Le fin!: Oui! Le fin pour moi.Passe un bon weekend : ) Adieuuuu
A: Toi aussi! Passez également un bon Halloween si vous le célébrez :D",11:50AM October 31
Mentor commented at,"4:11AM October 28 
Hi, Jen! I’m baaaack. Thanks for your patience : )) I got all my grades back. Honestly, I think I did as expected on one, better than expected on another, and worse than expected on the last one. So, to average out, I did ok. I’m 100% alright with that as ok is better than bad ahaha. 
Now that I’m outta that slump, I’ve been loosely job hunting. It’s been hard because everyone only wants full timers, or you need a class 5 license. I don’t even have a regular license. Right now, I applied for two accounting positions which I think I won’t get cause they did ask for people with experience. I applied anyways cause why not. Then I just applied for a concierge position. The hours are awful (for me). They want 8am to 4pm and I go to bed at 8am sometimes. 
My friend recently got hired for an accounting position which is fantastic. I’m super proud of her. But now I feel like I should be trying to gain more experience because I’ve been at my current job for almost two years now. I’m eyeing some receptionist roles, but my friend told me she had gone to a bunch of receptionist interviews and they’re super picky with hiring. 
One thing for sure – I will never go back to retail. No more Christmas songs for me, please. 
How’s your throat? Everyone around me has been sick for weeks. I think there’s a cold going around. I’ve definitely heard about lululemon people but usually they’re like lululemon teens rather than the moms. Is her dog super friendly? I remember loving going over to my friend’s house in hs because he had a dog. I wasn’t allowed a pet so I enjoyed the times with his dog. His name was pronounced as “Askim” so whenever people would ask my friend what his dog’s name is – he’d just say “Askim” as in Ask him. 
Ripley’s aquarium of Canada sounds cool. I love aquariums. Have you been to the Vancouver Aquarium? They have animals and insects along with the aquatic animals. I didn’t realize that wasn’t common until I went to one in Japan and they only had water creatures. 
Word of the day!: Hullabaloo – a loud, continued noise or mixture of noises. 
Are you good at sewing? I got a new tank top, but the strap ripped as soon as I tried it on. I sewed it back, but I don’t know if I did it correctly. 
Movies set in the past always have the best costumes. Sometimes I wish balls were still a thing so I could wear a fancy gown. 
Glad to hear everything went well in your appointment! One thing I always found interesting about the doctor is that, in Canada, we only go when there’s already an issue but in the States, they have regular checkups? Like do you just go there, have them ask a bunch of questions, then leave? What if you’re doing fine? Do they charge you if nothing is wrong but you went for a checkup anyways?
I did not know that the unicorn was Scotland’s official animal loool. That’s super interesting. I didn’t know you could have a mythical creature as your official animal. 
Song of the day: Charmer by Stray Kids. 
Oui! Le fin pour moi. Passe un bon weekend : ) Adieuuuu",4:11AM October 28
Mentee commented at,"12:35PM October 21 
Intro: Hey, Jen!
Thanks for your patience : ) I was able to catch up on work and finish my FIRST exam. I still have two more coming up so thanks in advance again for your continued consideration : D
I think I did fine? I’m a little nervous cause the prof gave us 3 hours to do it. I finished in 1.5 hours but I saw that everyone else was still writing (we were on zoom), so I sat there for 40 min. I was worried that if I left so early the prof might suspect me of cheating or something. So, 40 min passes, and everyone is still writing it. At that point, I was thinking to myself “I think this is enough time to clear me of suspicions” and then I left.
Yesterday, I couldn’t sleep so I was browsing YouTube. I saw a song called the Pi song. I managed to memorize 56 digits of pi. I will never need this skill ever, but I did it.
A: That's okay loll, I was hanging out with my best friend who came back to town from college this weekend (sorry for the small delay XD, I also have a sore throat as I am writing this at the moment haha.) and we just took her dog for a walk and joked about ""lululemon moms"" (if you don't know what they are, I think they're basically moms who have a coffee in one hand and walking their dog with the other, rofl. But idk if there are any in this case, lol) Oh in that case, congratulations (if you passed, idk if you did)
Q1: Thanksgiving lunch sounds delicious. I love cranberry sauce.
A: Lol.
Q2: I did wear a red dress. Now that I’m looking at it, the dress design is so outdated. For my year, like a third of my grade had a similar design. It’s like long, sleeveless dress, with flowers on the bodice going down onto the skirt but not covering all of the skirt, and a cinched waist. Now, I feel like a lot of the prom dresses are silky, sophisticated, and chic.
A: Nice, I think you might be right but I think it changes every year depending how long that trend will tend to stay lol.
Q3: Thanks for the heads up! I was looking up flights to Toronto recently. I didn’t realize they were at a relatively affordable price. For some reason, I thought it would be much higher. I also learned that there’s this train from VIA rail that goes all the way across Canada. I thought it would be a cool experience but wow it’s around 6k-10k. That’s more than my trip to Japan!
A: Rofl, I think it depends on what class you are registering into. (e.g, business class, economy). But yeah, if this is your first time going, I recommend checking out the CN Tower, Ripley's Aquarium of Canada and the Toronto Islands :D
Q4: A flying bird would be an ornithopter. Good example : )
A: Thanks XD
Q5: Word of the day!: Jabberwock – gibberish or nonsense.
You might have heard of “The Jabberwocky” by Lewis Carroll who featured it in his second Alice in Wonderland novel. 
A: Yes, I have! I beileve it might've been seen or mentioned in the Disney version of the movie.
Q6: I don’t mind carrots, but I think they taste better when they’re raw.  
A: Oh! Well, you do you :) No judgement here!
Q7: Yum. Looks like noodles are both our choices of a quick meal. I always make sure to add some eggs in.
A: Rofl!
Q8: Yes, ahah The Spanish Golden Age!
A: Lol! It did take place in Spain.
Q9: I think I said it was a bowl as well because mine had a ton of spaghetti in it. Most of us agreed it was a bowl except for one person who claimed it was a plate.
A: Oh haha, hilarious! It does give that illusion, and I almost thought it was a plate myself rofl
Q10: Winter is coming BUT WHERE IS MY AUTUMN. Every year, the autumn season seems to be non-existent. Summer doesn’t end until the end September and we get some hot days in October. November comes around and, at that point, it’s basically winter. My fav season : ( gone.
A: Fall does still exist, but yeah, the clock seems to be ticking faster than ever now.
Q11: Did you ever have to take home economics? We had to sew in that class. That year, we were making boxer shorts and mine came out absolutely awful. That day, I learned how terrible at sewing I was.
A: I did take sewing up until Grade 12 because I didn't like the teacher very much so I stopped in my senior year. I did take Foods class though and it was really fun!
Q12: Never seen the movie - Little Women. I want to read the book though.
A: It was pretty good to watch, suffice to say. They did a good job with the costumes and the settings. It made it seem like it really did take place in the Victorian Era if I do say so myself.
Q13: I don’t have a favourite flower. If I had to choose, I think tiny cacti are cute.
A: Lol, okay!
Last but not least, Q14: How did your appointment go?
A: Ah, it went well. Just talked about some health issues goin' on recently, nothing new lol.
Quote of the day: -""Things may come and go, but the stories will never be left behind.""
Fun fact of the day: Did you know that the unicorn is Scotland's official animal?
Song of the day: Match in the Rain by Alec Benjamin
Le fin: Have an excellent rest of your week!
A: You too, have a good one! :-)",12:35PM October 21
Mentor commented at,"12:45AM October 18 
Hey, Jen!
Thanks for your patience : ) I was able to catch up on work and finish my FIRST exam. I still have two more coming up so thanks in advance again for your continued consideration : D
I think I did fine? I’m a little nervous cause the prof gave us 3 hours to do it. I finished in 1.5 hours but I saw that everyone else was still writing (we were on zoom), so I sat there for 40 min. I was worried that if I left so early the prof might suspect me of cheating or something. So, 40 min passes, and everyone is still writing it. At that point, I was thinking to myself “I think this is enough time to clear me of suspicions” and then I left. 
Yesterday, I couldn’t sleep so I was browsing YouTube. I saw a song called the Pi song. I managed to memorize 56 digits of pi. I will never need this skill ever, but I did it. 
Thanksgiving lunch sounds delicious. I love cranberry sauce. 
I did wear a red dress. Now that I’m looking at it, the dress design is so outdated. For my year, like a third of my grade had a similar design. It’s like long, sleeveless dress, with flowers on the bodice going down onto the skirt but not covering all of the skirt, and a cinched waist. Now, I feel like a lot of the prom dresses are silky, sophisticated, and chic. 
Thanks for the heads up! I was looking up flights to Toronto recently. I didn’t realize they were at a relatively affordable price. For some reason, I thought it would be much higher. I also learned that there’s this train from VIA rail that goes all the way across Canada. I thought it would be a cool experience but wow it’s around 6k-10k. That’s more than my trip to Japan!
A flying bird would be an ornithopter. Good example : )
Word of the day!: Jabberwock – gibberish or nonsense. 
You might have heard of “The Jabberwocky” by Lewis Carroll who featured it in his second Alice in Wonderland novel.  
I don’t mind carrots, but I think they taste better when they’re raw.  
Yum. Looks like noodles are both our choices of a quick meal. I always make sure to add some eggs in. 
Yes, ahah The Spanish Golden Age!
I think I said it was a bowl as well because mine had a ton of spaghetti in it. Most of us agreed it was a bowl except for one person who claimed it was a plate. 
Song of the day: Super by Seventeen. 
Winter is coming BUT WHERE IS MY AUTUMN. Every year, the autumn season seems to be non-existent. Summer doesn’t end until the end September and we get some hot days in October. November comes around and, at that point, it’s basically winter. 
My fav season : ( 
gone. 
 
Did you ever have to take home economics? We had to sew in that class. That year, we were making boxer shorts and mine came out absolutely awful. That day, I learned how terrible at sewing I was. 
Never seen the movie - Little Women. I want to read the book though. 
I don’t have a favourite flower. If I had to choose, I think tiny cacti are cute. 
Bonus question – if you won a million dollars, what are your big plans with it? 
How did your appointment go?
Have an excellent rest of your week!",12:45AM October 18
