Person,Text,Date
Mentee commented at,"4:40PM January 2 
Intro: Thanks for waiting! How was the party?
A: That's okay. The party was fun but ended up coming home later than ever lol. How was your holiday and sickness?
Q1: Yeah, I wish I had watched Ponyo or something I know is really good since my friend isn’t typically interested in animated works or Studio Ghibli. I think she’s really into action films. What genre do you typically go for? I like action as well but not if action is the driving factor of the movie. I feel like the plot needs to be really good. I think I like drama, comedy, and fantasy. Maybe tragedies too. Weirdly enough, I read a decent amount of romance but I don’t like movies in that genre.
A: Lol cool. I don't really know about what genre, just whatever piques my interest :D But I am planning on seeing Dune 2 with my friends :)
Q2: Thank you! Maybe it’s due to the weather but it’s been cooperating somewhat this winter.
A: Oh for what? (I might've forgot maybe lol sorry and also my brain is still on holiday mode)
Q3: Did it snow heavily or was it a light sprinkle? It hasn’t rained a lot here but when it does, it absolutely pours.
A: I think it was a light sprinkle. And yeah I feel you, it rains a ton where I live currently.
Q4: Since I’ve been mostly homebound the past few days, I’ve been catching up on my reading. I read Tender is the Flesh, some Junji Ito stories, and Erha He Ta De Bai Mao Shizun(2-4). I tend to buy books at a faster rate than I read them. I’m glad I was able to check these off the list. Now I’m trying to decide if I should now read the books I got recently or the novels I got years ago. My issue is that I have a sizeable number of novels I got when I was in my teens that I haven’t touched. My tastes have changed since then. I feel bad if I donate those books without even giving them a chance, but I also don’t want to try to read a ton of books only to drop all of them in succession. Or what if I donate all of them and end up missing a gem that I would’ve loved.
A: Lol, sounds nice. I mostly read graphic novels when I was in middle school. (e.g, Amulet, the Smile book series)
Q5: What sweets does your mom make? Not sweets but I’ve been wanting to make some homemade dumplings.
A: I think I’m looking forward to the new year. Other than being nervous about my new job, I think a new year means new opportunities. Also, it’s another year of birthdays. I loveeeeee buying birthday gifts. I think it’s fun trying to think of something that your friend would love. I want to go on more vacations in the future too. What I don’t like is thinking about how I’m slowly getting older. What about you? Do you ever feel like time is moving too fast or too slow?
A: Awesome! You do you :D And yeah time is going pretty fast, but when summer comes around, it gets a bit slower
Q6: You’re right. Faux leather does tear easily. That’s why I’m eyeing some real leather pieces. Pricey but I’ll probably get them after I get my big boy adult job paycheck ahaha.
A: I mean if it's not really expensive as YSL or Gucci, I guess they are a bit expensive but I don't really know. But good luck!
Q7: I do like the style of cargo pants. I was looking at a few from Aritzia. I haven’t seen any with elastic cuffs though. Belts are a good idea. I was looking at one from yes-style that looked cool. It had a metal buckle.
A: That's great :D
Last but not least, Q8: Happy new year! Hope you had a fantastic 2023 and cheers to another amazing year :) It has been absolutely wonderful getting to know you. Hearing your opinions and thoughts no matter how big or small they are has been invaluable to me. I hope, throughout this journey, I've been a helpful companion as well. Let's both work hard and strive to continue learning, exploring, and loving the world around us. For any hardships you may have had in 2023, I hope 2024 brings you the strength to overcome them : ) and that you continue to be surrounded by your friends and family.
A: You too, thank you! I wish nothing but happiness and peace in your life <3 You really are an amazing human being :)
QOTD: What's your favourite hobby?
Song of the day: Sunflower by Post Malone and Swae Lee :D
Take care!
A: You too! Have a good one :)",4:40PM January 2
Mentor commented at,"12:13AM January 2 
Thanks for waiting!
How was the party?
Yeah, I wish I had watched Ponyo or something I know is really good since my friend isn’t typically interested in animated works or Studio Ghibli. I think she’s really into action films. What genre do you typically go for? I like action as well but not if action is the driving factor of the movie. I feel like the plot needs to be really good. I think I like drama, comedy, and fantasy. Maybe tragedies too. Weirdly enough, I read a decent amount of romance but I don’t like movies in that genre. 
Thank you! Maybe it’s due to the weather but it’s been cooperating somewhat this winter. 
Did it snow heavily or was it a light sprinkle? It hasn’t rained a lot here but when it does, it absolutely pours. 
Since I’ve been mostly homebound the past few days, I’ve been catching up on my reading. I read Tender is the Flesh, some Junji Ito stories, and Erha He Ta De Bai Mao Shizun(2-4). I tend to buy books at a faster rate than I read them. I’m glad I was able to check these off the list. Now I’m trying to decide if I should now read the books I got recently or the novels I got years ago. My issue is that I have a sizeable number of novels I got when I was in my teens that I haven’t touched. My tastes have changed since then. I feel bad if I donate those books without even giving them a chance, but I also don’t want to try to read a ton of books only to drop all of them in succession. Or what if I donate all of them and end up missing a gem that I would’ve loved. 
What sweets does your mom make? Not sweets but I’ve been wanting to make some homemade dumplings. 
You’re right. Faux leather does tear easily. That’s why I’m eyeing some real leather pieces. Pricey but I’ll probably get them after I get my big boy adult job paycheck ahaha. 
I do like the style of cargo pants. I was looking at a few from Aritzia. I haven’t seen any with elastic cuffs though. Belts are a good idea. I was looking at one from yesstyle that looked cool. It had a metal buckle. 
I think I’m looking forward to the new year. Other than being nervous about my new job, I think a new year means new opportunities. Also, it’s another year of birthdays. I loveeeeee buying birthday gifts. I think it’s fun trying to think of something that your friend would love. I want to go on more vacations in the future too. What I don’t like is thinking about how I’m slowly getting older. What about you? Do you ever feel like time is moving too fast or too slow? 
Song of the day: Beam Beam by Jeon Soyeon. 
Take care!",12:13AM January 2
Mentor commented at,"5:03AM January 1 
Hey Jen! Sorry my response is a little late. I caught a really bad cold (prob from my sister lol) a few days ago and I'm still healing from it. I basically slept most of the last couple of days. I should have a complete response done by tonight or tmr by the latest. 
Regardless, happy new year! Hope you had a fantastic 2023 and cheers to another amazing year :) 
It has been absolutely wonderful getting to know you. Hearing your opinions and thoughts no matter how big or small they are has been invaluable to me. I hope, throughout this journey, I've been a helpful companion as well. Let's both work hard and strive to continue learning, exploring, and loving the world around us. For any hardships you may have had in 2023, I hope 2024 brings you the strength to overcome them : ) and that you continue to be surrounded by your friends and family. 
Alright! That's all from me. I'm off to take another power nap (to help get rid of this cold). Take care!",5:03AM January 1
Mentee commented at,"11:33AM December 28 
Intro: Merry Christmas, Jen! I’m a little late but there’s still the New Years. Happy New Years in advance! I hope this year was good to you and that it gets even better next year : )
Thanks! You too :D
Q1: Are you doing anything for the New Years?
A: Yep, my family-friends are throwing a party lol
Q2: Ooo how was the movie? I kinda wanted to see it as well but my friends didn’t. We watched the New Studio Ghibli movie instead, but they didn’t like it. I think compared to the previous movies by the same studio, the new one wasn’t as good.
A: Surprisingly, it was pretty good! I thought it wouldn't be good, but oh boy it was super well done :D Haha, fair enough. It probably wasn't their cup of tea. Most new movies nowadays don't really live up to the hype anymore so I get where your friends are coming from.
Q3: Yeah! For some odd reason, the right side of my face has a tendency to get drier than the left side. Sometimes when I wear makeup, it peels a little. It’s there and the area between my eyebrows that tend to be dry.
a: Augh.. that doesn't sound good. I hope it gets better
Q4: Thank you! Unfortunately (or fortunately depending on your outlook), there’s no available work at the moment. That means I’ve been spending the last few days meeting with friends and playing games. Fantastic way to spend the holidays. I’m surprised that it hasn’t snowed here yet. It also didn’t rain much either. It’s been an odd year when it comes to the weather.
A: I mean.. at least you can take a break to catch up with friends, hangout, etc. It actually snowed a while ago where I currently live, but it didn't stick around long lol.
Q5: I don’t think I do. I am craving cream puffs right now for some odd reason. Maybe because I saw a bunch out for the holidays? Candy canes are a good treat every now and then too. Do you have any? Maybe hot chocolate?
A: Hot chocolate is good! My mom also makes sweets during the holidays as well :D
Q6: I used to shop at Guess a lot when I was younger. My mom loved Guess too. I had this beautiful biker jacket for many years. Sadly, it ripped (because it was faux leather) a few months ago : (. RIP my beautiful jacket. I’ll remember you as my first leather jacket forever.
A: Awh, that's sad :( I'm sorry. That's why I don't really like to buy faux leather products (including clothing) because I keep hearing that it tears apart a lot.
Q7: I tried. I only found two that were alright (the two that I currently own). One is still a little long and I have to wear platforms for it to work and the other one is fine but a little big on the waist. I found that it’s difficult to find pants with a shorter inseam. Aritzia has that option which is why I tend to go there for pants. I used to go to Topshop too until they closed down in Canada a few years ago. Brands like H&M, Zara, Oak and Fort, etc don’t usually have petite options.  
A: Have you tried cargo pants? Not sure if they're your cup of tea, but most of them have elastic cuffs on the bottom so I think it should be okay for petite frames :) And as for waist part, have you tried wearing a belt? I found it helps half the time. You don't have to set it to the tightest belt hole.
Q8: That’s alright. I’m slowly branching out from jeans by going for trousers. I like how versatile they are because you can dress them down or up. With jeans, it’s not usually allowed in a professional setting.
A: Lol, fair enough
Quote of the day: -""Today might not the day you were wishing for, but what matter is the people you love who were there.""
QOTD: Are you looking forward to the new year? Why or why not?
Song of the day: Rewrite the Stars by Zac Efron and Zendaya
Have a fantastic last week of 2023!!
A: You too, Happy New Year 🎉✨",11:33AM December 28
Mentor commented at,"7:13AM December 28 
Merry Christmas, Jen! I’m a little late but there’s still the New Years. Happy New Years in advance! I hope this year was good to you and that it gets even better next year : )
Are you doing anything for the New Years?
Ooo how was the movie? I kinda wanted to see it as well but my friends didn’t. We watched the New Studio Ghibli movie instead, but they didn’t like it. I think compared to the previous movies by the same studio, the new one wasn’t as good. 
Yeah! For some odd reason, the right side of my face has a tendency to get drier than the left side. Sometimes when I wear makeup, it peels a little. It’s there and the area between my eyebrows that tend to be dry.
Thank you! Unfortunately (or fortunately depending on your outlook), there’s no available work at the moment. That means I’ve been spending the last few days meeting with friends and playing games. Fantastic way to spend the holidays. I’m surprised that it hasn’t snowed here yet. It also didn’t rain much either. It’s been an odd year when it comes to the weather.
I used to shop at Guess a lot when I was younger. My mom loved Guess too. I had this beautiful biker jacket for many years. Sadly, it ripped (because it was faux leather) a few months ago : (. RIP my beautiful jacket. I’ll remember you as my first leather jacket forever. 
I tried. I only found two that were alright (the two that I currently own). One is still a little long and I have to wear platforms for it to work and the other one is fine but a little big on the waist. I found that it’s difficult to find pants with a shorter inseam. Aritzia has that option which is why I tend to go there for pants. I used to go to Topshop too until they closed down in Canada a few years ago. Brands like H&M, Zara, Oak and Fort, etc don’t usually have petite options.  
That’s alright. I’m slowly branching out from jeans by going for trousers. I like how versatile they are because you can dress them down or up. With jeans, it’s not usually allowed in a professional setting. 
I don’t think I do. I am craving cream puffs right now for some odd reason. Maybe because I saw a bunch out for the holidays? Candy canes are a good treat every now and then too. Do you have any? Maybe hot chocolate?
Song of the day: Tuxedo - Do It
Have a fantastic last week of 2023!!",7:13AM December 28
Mentee commented at,"10:51AM December 25 
Intro: Hi Jen! Thanks for waiting. I see that you’ll be busy this week with some events so no rush in responding : ) What volunteer work are you doing?
Hey Lisa, merry Christmas!!! (at the time I'm writing this haha) and the volunteer work me and my friend did was greet people in Walmart and collect money on behalf of Salvation Army. And also me and my friends went to go see the Wonka movie :D
Q1: Thank you for the positive reminder! Was a boost to my mood while I was desperately cramming for my exams haha
A: Woohoo!! Glad it helped :D
Q2: I heard Garnier is good. I used to have a hyaluronic acid serum. I switched to Beta Glucan cause my toner already had some hyaluronic acid. What do you usually look for in skincare? I try to find products that are very hydrating since my skin easily gets dry.
A: Lol. Same like you, I try not to look for products that make my skin dry. Even though I have oily/combination skin, I still want to keep it hydrated and healthy anyways.
Q3: The cat is super cute! Now that my exams are over, I’m meeting all my friends. Until school starts back up, that’s 3 times a week that I have something planned with friends. (If I reply a little slow, I probably went out with my friends and passed out as soon as I got home lol I get tired some social events really easily). Since I have so many different groups, I’m trying to get all of them to go to the cat café so I have an excuse to go back.
A: Sounds fun, lol!
Q4: Studying was ehhh. I’m still feeling exhausted from the exams since they were basically back to back AND they were 3 hours long. AAAAAND I had to travel 1.5 hours there and 2 hours back. My finance exam, I studied for about 14-16 hours, 10-12 for my tax exam, and 5 ish hours for my data viz exam. Going out 7 days in a row is sucking my energy away. Unfortunately, now I have to catch up on work.
A: Oh woah, that sucks. I'm sorry. I hope your sleep schedule gets better. I wish you luck on your work :)
Q5: The party was fantastic. Buying ingredients and cooking our own food was a lot cheaper than ordering take out. Had a present exchange : ) I got a cool ditto plushie.
A: Haha, that's awesome! Glad you had fun :D
Q6: Are you lactose? I have difficulties with cheese too.
A: Yes, I think so. 
Q7: 0 or -5 is FREEZING. I’m busting out my winter jackets when it hits below 10 degrees. At -5, I’m staying home or I’m completely bundled up.
A: Haha, lol.
Q8: Hmm I think I like winter? Spring is still kinda cold here since it’s always raining. Then I’m constantly sneezing because of the pollen. The weather is too unpredictable with cold mornings and hot afternoons.  Winter is consistent. It shall be cold and remain cold.
A: Fair enough haha, I guess it all depends on where you are and the environment around you. Some places can be hot during the winter season, whereas it can be cold.
Q9: I know some people tend to look for graphic tees with minimal design, others love flashy designs, some only go for no image + writing, while others do only images, etc etc. I know of mom jeans… never heard of dad jeans. That’s interesting. I usually wear skinnies but I some two straight leg/wide leg jeans. They’re cool. I do have some troubles styling it. I’m short so it feels like the pants are eating up my entire frame.
A: Lol, I looooove graphic prints. I get most of them from Ardene, H&M, Forever 21 and some from Guess :) Dad jeans are kind of a thing from Levi's haha. And also have you tried looking for shorter ones? I think some jeans have different inseam lengths for different heights (not 100% sure)
QOTD: Do you have any favourite food/treats during the holidays?
Song of the day: Pure Imagination (lofi version) by Dotan Negrin + Prismatic Mantis
Have fun this week! Don’t forget to take care of yourself : )
A: You too! Happy holidays 🎄✨",10:51AM December 25
Mentor commented at,"12:59PM December 20 
Hi Jen! Thanks for waiting. I see that you’ll be busy this week with some events so no rush in responding : ) What volunteer work are you doing? 
Thank you for the positive reminder! Was a boost to my mood while I was desperately cramming for my exams haha
I heard Garnier is good. I used to have a hyaluronic acid serum. I switched to Beta Glucan cause my toner already had some hyaluronic acid. What do you usually look for in skincare? I try to find products that are very hydrating since my skin easily gets dry. 
The cat is super cute! Now that my exams are over, I’m meeting all my friends. Until school starts back up, that’s 3 times a week that I have something planned with friends. (If I reply a little slow, I probably went out with my friends and passed out as soon as I got home lol I get tired some social events really easily). Since I have so many different groups, I’m trying to get all of them to go to the cat café so I have an excuse to go back. 
Studying was ehhh. I’m still feeling exhausted from the exams since they were basically back to back AND they were 3 hours long. AAAAAND I had to travel 1.5 hours there and 2 hours back. My finance exam, I studied for about 14-16 hours, 10-12 for my tax exam, and 5 ish hours for my data viz exam. Going out 7 days in a row is sucking my energy away. Unfortunately, now I have to catch up on work. 
The party was fantastic. Buying ingredients and cooking our own food was a lot cheaper than ordering take out. Had a present exchange : ) I got a cool ditto plushie. 
I know some people tend to look for graphic tees with minimal design, others love flashy designs, some only go for no image + writing, while others do only images, etc etc. I know of mom jeans… never heard of dad jeans. That’s interesting. I usually wear skinnies but I some two straight leg/wide leg jeans. They’re cool. I do have some troubles styling it. I’m short so it feels like the pants are eating up my entire frame. 
Are you lactose? I have difficulties with cheese too. 
0 or -5 is FREEZING. I’m busting out my winter jackets when it hits below 10 degrees. At -5, I’m staying home or I’m completely bundled up. 
Hmm I think I like winter? Spring is still kinda cold here since it’s always raining. Then I’m constantly sneezing because of the pollen. The weather is too unpredictable with cold mornings and hot afternoons.  Winter is consistent. It shall be cold and remain cold. 
 
Have fun this week! Don’t forget to take care of yourself : )",12:59PM December 20
Mentee commented at,"10:05AM December 14 
Hi, best of luck with your finals :D Doesn't matter when you respond but however next week will be mixed w/ some events for me as well because one of the days I will be joining my friend (since we're volunteering) and will be getting together for gift exchanges at some point lol. So my response time will be not-so-active either since my mind is currently on lazy mode rofl. But yeh, take your time. I'm still around but don't rush yourself :) Don't forget to stay hydrated and don't forget to eat!!!
Positive reminder of the day: You are smart and cool :)
Hope to talk soon! ʕ·ᴥ·ʔっ
-Jen",10:05AM December 14
Mentor commented at,"11:09PM December 11 
Hey Jen!
Just a heads up, I'm now during finals season. My last final is in a week so I might not be able to respond in the meantime, but I'll try my best! Otherwise, I should be able to respond by the 19th if that's alright with you : )
Lemme know!",11:09PM December 11
Mentee commented at,"3:35PM December 11 
Hi Lisa, apologies for delaying my reply lol. I promise I'm still around! Was a bit busy, and yes we finished the tree :D
Q1: Hmm, what kind of face wash is it? Vitamin C serum absolutely counts. I heard it’s really good for reducing acne scars.
A: I use Garnier (the hyaluronic acid collection)
Q2: Group projects for you too? Thank you! I’m all done with my group projects including my in-class presentation. As of now, I’m officially done with all my classes. I got my finals in a week then 2.5 weeks of sweet, sweet vacation.
A: Not sure what you are talking about lol. And cool :)
Q3: Good news! You are now talking to someone who has a full-time accounting clerk position starting in January. I got a few offers, so I emailed around and asked if my first choice would take me : D. Surprisingly, today I got another request for an interview for a game studio (still an accounting position). I thought I might as well do the interview and see how I do though I’m most likely going to stick with what I got now.
A: Congratulations :D
Q4: Yesterday my friend bought me dinner as congrats for the job so I took her to the cat café. (Pic included). My fav cat is getting adopted. I’m happy for her but also a little sad that I won’t see her anymore : (
A: That sucks, I'm sorry :( It must've been fun while it lasted. I'm glad you got to bond with her before. But she looks so cute!!!
Q5: Today, I’m going out to study with a friend. Tomorrow, we’re having a Birthday/Christmas/Hot pot party at my friend’s place again. I’m excited to give out my gifts. Usually, I don’t send out Christmas cards. I got a few requests this year, so I bought a box. I struggled to fill them out since I see my friends so often, I had no idea what to say. For one of them, I added, “You usually have cool pants.” Ahahah. Do you usually give your friend Christmas cards?
A: Cool :D How did it go? (the party and the studying)
Q6: I also heard about Disney cruises being well-known for their quality. Don’t know if I would want to be on a Disney themed cruise though.
A: Ye, but I've never been in one though lol.
Q7: Do you prefer a specific type of graphic tee or jeans? I used to only wear skinnies. Now I’m branching out to other styles like flared and wide leg. Right now, flared pants are my fav style. How do you feel about clothing patterns such as gingham, cow print, etc?
A: For patterns, I don't mind it I guess, lol. Not sure what you mean about specific graphic tee though XD. As for jeans, I wear mom jeans, loose/baggy jeans and I've been looking to try dad jeans (yes, that's kind of a thing from Levi's lol) and I've seen most people wear jeans with Converse or Nikes haha
Last but not least, Q8: At what temperature do you pull out the winter jackets? What is the best type of cheese?
A: Typically below 0 or -5 lol. How about you? Uhh as for cheese, I tend to avoid it whenever because I can't really eat it, sorry :(
QOTD: Do you like snow or do you prefer spring weather?
Take care!
You too, have a good one :D",3:35PM December 11
